model,provider,price_basis,input_cache_hit_usd_per_1m,input_cache_hit_multiplier,input_cache_miss_usd_per_1m,input_cache_miss_multiplier,output_usd_per_1m,output_multiplier,source_url,notes
DeepSeek V4 Flash,DeepSeek,Standard API current,0.0028,1.00,0.14,1.40,0.28,1.00,https://api-docs.deepseek.com/quick_start/pricing,Official model id deepseek-v4-flash. deepseek-chat and deepseek-reasoner are compatibility aliases until deprecation on 2026-07-24 15:59 UTC.
Xiaomi MiMo-V2.5,Xiaomi MiMo,Overseas API V2.5 reduced price,0.0028,1.00,0.14,1.40,0.28,1.00,https://mimo.mi.com/docs/en-US/price/pay-as-you-go,"Official model id mimo-v2.5. Reduced price effective 2026-05-27 00:00 Beijing time. Domestic price is cache hit CNY 0.02, input CNY 1.00, output CNY 2.00 per 1M tokens. Cache writing is currently free for a limited time. Legacy V2 names auto-route to V2.5 pricing on staggered dates and are scheduled for deprecation at 2026-06-30 00:00 GMT+8."
Xiaomi MiMo-V2.5-Pro,Xiaomi MiMo,Overseas API V2.5 reduced price,0.0036,1.29,0.435,4.35,0.87,3.11,https://mimo.mi.com/docs/en-US/price/pay-as-you-go,"Official model id mimo-v2.5-pro. Reduced price effective 2026-05-27 00:00 Beijing time. Domestic price is cache hit CNY 0.025, input CNY 3.00, output CNY 6.00 per 1M tokens. Cache writing is currently free for a limited time. Legacy V2 names auto-route to V2.5 pricing on staggered dates and are scheduled for deprecation at 2026-06-30 00:00 GMT+8."
DeepSeek V4 Pro,DeepSeek,Standard API current,0.003625,1.29,0.435,4.35,0.87,3.11,https://api-docs.deepseek.com/quick_start/pricing,Official model id deepseek-v4-pro. Supports 1M context and 384K max output.
GPT-5.4 Nano,OpenAI,Standard API short context,0.01,3.57,0.1,1.00,0.625,2.23,https://developers.openai.com/api/docs/pricing,"Official model id gpt-5.4-nano. Standard short-context pricing; long-context price is not listed. Regional processing adds 10% uplift. Batch, Flex, and Priority prices are excluded."
Gemini 3.1 Flash-Lite,Google,Standard paid tier text/image/video,0.025,8.93,0.25,2.50,1.5,5.36,https://ai.google.dev/gemini-api/docs/pricing,"Official model id gemini-3.1-flash-lite. Audio pricing, Batch/Flex/Priority tiers, Google Search, Maps grounding, and cache storage are excluded. Context caching storage is USD 1.00 per 1M tokens per hour."
GPT-5.4 Mini,OpenAI,Standard API short context,0.0375,13.39,0.375,3.75,2.25,8.04,https://developers.openai.com/api/docs/pricing,"Official model id gpt-5.4-mini. Standard short-context pricing; long-context price is not listed. Regional processing adds 10% uplift. Batch, Flex, and Priority prices are excluded."
GPT-5.4 (short context),OpenAI,Standard API <=272K input tokens,0.13,46.43,1.25,12.50,7.5,26.79,https://developers.openai.com/api/docs/pricing,"Official model id gpt-5.4. Short-context pricing applies up to 272K input tokens; regional processing adds 10% uplift. Batch, Flex, and Priority lower/higher variants are excluded."
Kimi K2.6,Moonshot AI / Kimi,Standard API,0.16,57.14,0.95,9.50,4,14.29,https://platform.kimi.ai/docs/pricing/chat-k26,"Official model id kimi-k2.6. Context window 262,144 tokens; supports automatic context caching. Current top-up voucher promotion is excluded from token unit prices."
Kimi K2.7 Code,Moonshot AI / Kimi,Standard API,0.19,67.86,0.95,9.50,4,14.29,https://platform.kimi.ai/docs/pricing/chat-k27-code,"Official model id kimi-k2.7-code. Context window 262,144 tokens; supports automatic context caching. Current top-up voucher promotion is excluded from token unit prices."
GLM-5,Z.AI,Standard API,0.2,71.43,1,10.00,3.2,11.43,https://docs.z.ai/guides/overview/pricing,Cached input storage is listed as limited-time free.
Gemini 3.1 Pro Preview (<=200K prompts),Google,Standard paid tier <=200K prompts,0.2,71.43,2,20.00,12,42.86,https://ai.google.dev/gemini-api/docs/pricing,Official model id gemini-3.1-pro-preview. Context caching storage is USD 4.50 per 1M tokens per hour.
GLM-5-Turbo,Z.AI,Standard API,0.24,85.71,1.2,12.00,4,14.29,https://docs.z.ai/guides/overview/pricing,Cached input storage is listed as limited-time free.
GPT-5.4 (long context),OpenAI,Standard API >272K input tokens,0.25,89.29,2.5,25.00,11.25,40.18,https://developers.openai.com/api/docs/pricing,"Official model id gpt-5.4. Long-context pricing applies to prompts over 272K input tokens; regional processing adds 10% uplift. Batch, Flex, and Priority lower/higher variants are excluded."
GPT-5.5 (short context),OpenAI,Standard API <=272K input tokens,0.25,89.29,2.5,25.00,15,53.57,https://developers.openai.com/api/docs/pricing,"Official model id gpt-5.5. Short-context pricing applies up to 272K input tokens; regional processing adds 10% uplift. Batch, Flex, and Priority lower/higher variants are excluded."
GLM-5.1,Z.AI,Standard API,0.26,92.86,1.4,14.00,4.4,15.71,https://docs.z.ai/guides/overview/pricing,Cached input storage is listed as limited-time free.
GLM-5.2,Z.AI,Standard API,0.26,92.86,1.4,14.00,4.4,15.71,https://docs.z.ai/guides/overview/pricing,Cached input storage is listed as limited-time free.
Gemini 3.5 Flash,Google,Standard paid tier,0.27,96.43,2.7,27.00,16.2,57.86,https://ai.google.dev/gemini-api/docs/pricing,"Official model id gemini-3.5-flash. Batch/Flex/Priority tiers, Google Search, Maps grounding, and cache storage are excluded. Context caching storage is USD 1.00 per 1M tokens per hour."
Kimi K2.7 Code HighSpeed,Moonshot AI / Kimi,HighSpeed API,0.38,135.71,1.9,19.00,8,28.57,https://platform.kimi.ai/docs/pricing/chat-k27-code,"Official model id kimi-k2.7-code-highspeed. High-speed version of Kimi K2.7 Code with the same 262,144 token context window; supports automatic context caching. Current top-up voucher promotion is excluded from token unit prices."
Gemini 3.1 Pro Preview (>200K prompts),Google,Standard paid tier >200K prompts,0.4,142.86,4,40.00,18,64.29,https://ai.google.dev/gemini-api/docs/pricing,Official model id gemini-3.1-pro-preview. Context caching storage is USD 4.50 per 1M tokens per hour.
Claude Opus 4.7,Anthropic,Standard Claude API global routing,0.5,178.57,5,50.00,25,89.29,https://platform.claude.com/docs/en/about-claude/pricing,Includes the full 1M token context window at standard pricing. Uses the newer Opus tokenizer. Cache hits/cache refreshes are USD 0.50/MTok; 5m cache write is USD 6.25/MTok and 1h cache write is USD 10/MTok. US-only inference uplift is excluded.
Claude Opus 4.8,Anthropic,Standard Claude API global routing,0.5,178.57,5,50.00,25,89.29,https://platform.claude.com/docs/en/about-claude/pricing,Includes the full 1M token context window at standard pricing. Uses the newer Opus tokenizer and has fast mode available at premium pricing. Cache hits/cache refreshes are USD 0.50/MTok; 5m cache write is USD 6.25/MTok and 1h cache write is USD 10/MTok. Fast mode and US-only inference uplift are excluded.
GPT-5.5 (long context),OpenAI,Standard API >272K input tokens,0.5,178.57,5,50.00,22.5,80.36,https://developers.openai.com/api/docs/pricing,"Official model id gpt-5.5. Long-context pricing applies to prompts over 272K input tokens; regional processing adds 10% uplift. Batch, Flex, and Priority lower/higher variants are excluded."
Claude Fable 5,Anthropic,Standard Claude API global routing,1,357.14,10,100.00,50,178.57,https://platform.claude.com/docs/en/about-claude/pricing,Generally available from 2026-06-09. Includes 1M context and 128K max output. Cache hits/cache refreshes are USD 1/MTok; 5m cache write is USD 12.50/MTok and 1h cache write is USD 20/MTok. US-only inference uplift is excluded.
Claude Mythos 5,Anthropic,Standard Claude API global routing limited availability,1,357.14,10,100.00,50,178.57,https://platform.claude.com/docs/en/about-claude/pricing,Limited availability through Project Glasswing from 2026-06-09. Includes 1M context and 128K max output. Cache hits/cache refreshes are USD 1/MTok; 5m cache write is USD 12.50/MTok and 1h cache write is USD 20/MTok. US-only inference uplift is excluded.
